{
  "_generated": "GENERATED by scripts/generate.ts — edit marketplace.config.ts instead",
  "name": "devkit",
  "description": "Engineering-discipline skills for AI coding agents: pinned dev environments, test strategy, clean code, security, and navigable repos",
  "version": "0.2.0",
  "contextFileName": "GEMINI.md"
}
